{
  "schema_version": "program-007-unit-changing-action-ledger-v2",
  "ledger_id": "program-007-public-unit-changing-action-ledger-2026-08-29-v2",
  "program_id": "multi-hour-sector-etf-research-006",
  "status": "PUBLIC-EVIDENCE-INCOMPLETE-DATASET-ADMISSION-BLOCKED",
  "schema_binding": {
    "path": "config/research/program-007-unit-changing-action-ledger-v2.schema.json",
    "sha256": "36b74f6b8facd55176eba8d08075d6eb3276ae938bf424c3af75adaba81c8d78"
  },
  "chronology": {
    "start_session": "2020-06-26",
    "end_session": "2026-07-31",
    "prehistory_rule": "Coverage begins twenty XNYS sessions before the 2020-07-27 feature chronology so every prior-20-session same-clock relative-volume input is covered. No conclusion extends beyond the frozen dates."
  },
  "normalization": {
    "basis": "The basis is the share unit in use on the session whose relative-volume feature is being computed.",
    "factor_representation": "exact Fraction new_shares/old_shares",
    "effective_boundary": "For an action effective before the market open, every bar on the effective session is already in post-action units. The preceding XNYS session remains in pre-action units.",
    "prior_volume_rule": "Multiply each prior-session same-clock share count by every exact new_shares/old_shares ratio whose effective session is after the source session and on or before the basis session.",
    "same_session_price_rule": "Retain raw contemporaneous prices for fills, marks, and same-session calculations. Do not create a provider-adjusted or repository-adjusted historical price view.",
    "same_session_return_proof": "Within one session the split factor f is constant, so (f*p1)/(f*p0)-1 equals p1/p0-1.",
    "raw_dollar_volume_proof": "For split ratio r, post-unit price times post-unit volume is (p/r)*(v*r)=p*v, so raw contemporaneous dollar volume is unit invariant.",
    "reverse_split_rule": "Use the same new_shares/old_shares orientation. A 1-for-5 reverse split maps a pre-action share count to the post-action basis by multiplying by 1/5.",
    "multiple_action_rule": "Multiply exact ratios in effective-session order. Crossing the same actions in reverse divides by the same cumulative factor."
  },
  "non_transformable_policy": {
    "scope": "Any ambiguous action, identity break, spin-off, reorganization, or other event whose share-unit mapping is not established by authoritative evidence.",
    "action": "FAIL-DATASET-ADMISSION-BEFORE-STRATEGY",
    "missingness_budget_can_override": false,
    "reason": "Program 007 does not invent reciprocal volume or price semantics for non-split actions. A new reviewed ledger version is required before affected feature windows may be admitted."
  },
  "symbols": [
    {
      "symbol": "IWM",
      "fund_identity": "iShares Russell 2000 ETF",
      "coverage_start": "2020-06-26",
      "coverage_end": "2026-07-31",
      "conclusion": "COVERAGE-UNRESOLVED",
      "action_ids": [],
      "evidence_ids": [
        "ishares-iwm-current-fund-page",
        "sec-iwm-program-007-corpus",
        "nyse-corpax-windowed-archive",
        "nyse-corporate-actions-client-spec",
        "cftc-iwm-2005-split-record"
      ],
      "continuity_notes": "The retrieved sources identify IWM and no applicable action, but the issuer CIK is a multi-series trust and the public exchange archive excludes forward splits. Full-period unit-action coverage is unresolved.",
      "coverage_status": "INCOMPLETE"
    },
    {
      "symbol": "MDY",
      "fund_identity": "State Street SPDR S&P MidCap 400 ETF Trust",
      "coverage_start": "2020-06-26",
      "coverage_end": "2026-07-31",
      "conclusion": "COVERAGE-UNRESOLVED",
      "action_ids": [],
      "evidence_ids": [
        "sec-mdy-program-007-corpus",
        "nyse-corpax-windowed-archive",
        "nyse-corporate-actions-client-spec"
      ],
      "continuity_notes": "The complete date-bounded SEC submission screen and NYSE identity record found no unit action, but no issuer-certified action archive closes the 2026 reporting-lag interval or forward-split scope. Coverage is unresolved.",
      "coverage_status": "INCOMPLETE"
    },
    {
      "symbol": "SPY",
      "fund_identity": "State Street SPDR S&P 500 ETF Trust",
      "coverage_start": "2020-06-26",
      "coverage_end": "2026-07-31",
      "conclusion": "COVERAGE-UNRESOLVED",
      "action_ids": [],
      "evidence_ids": [
        "sec-spy-program-007-corpus",
        "nyse-corpax-windowed-archive",
        "nyse-corporate-actions-client-spec"
      ],
      "continuity_notes": "The complete date-bounded SEC submission screen and NYSE identity record found no unit action, but no issuer-certified action archive closes the late-period reporting interval or forward-split scope. Coverage is unresolved.",
      "coverage_status": "INCOMPLETE"
    },
    {
      "symbol": "XLB",
      "fund_identity": "State Street Materials Select Sector SPDR ETF",
      "coverage_start": "2020-06-26",
      "coverage_end": "2026-07-31",
      "conclusion": "APPLICABLE-ACTIONS-RECORDED",
      "action_ids": [
        "sector-spdr-XLB-2025-12-05-2-for-1"
      ],
      "evidence_ids": [
        "state-street-2025-sector-split-notice",
        "miax-2025-sector-split-alert",
        "sec-sector-2026-semiannual-note-13",
        "sec-sector-program-007-corpus",
        "nyse-corpax-windowed-archive",
        "nyse-corporate-actions-client-spec"
      ],
      "continuity_notes": "The complete date-bounded Select Sector action-capable SEC corpus records the 2-for-1 split effective 2025-12-05 and no other applicable unit-changing action.",
      "coverage_status": "COMPLETE"
    },
    {
      "symbol": "XLE",
      "fund_identity": "State Street Energy Select Sector SPDR ETF",
      "coverage_start": "2020-06-26",
      "coverage_end": "2026-07-31",
      "conclusion": "APPLICABLE-ACTIONS-RECORDED",
      "action_ids": [
        "sector-spdr-XLE-2025-12-05-2-for-1"
      ],
      "evidence_ids": [
        "state-street-2025-sector-split-notice",
        "miax-2025-sector-split-alert",
        "sec-sector-2026-semiannual-note-13",
        "sec-sector-program-007-corpus",
        "nyse-corpax-windowed-archive",
        "nyse-corporate-actions-client-spec"
      ],
      "continuity_notes": "The complete date-bounded Select Sector action-capable SEC corpus records the 2-for-1 split effective 2025-12-05 and no other applicable unit-changing action.",
      "coverage_status": "COMPLETE"
    },
    {
      "symbol": "XLF",
      "fund_identity": "State Street Financial Select Sector SPDR ETF",
      "coverage_start": "2020-06-26",
      "coverage_end": "2026-07-31",
      "conclusion": "NO-APPLICABLE-ACTION-FOUND",
      "action_ids": [],
      "evidence_ids": [
        "sec-sector-program-007-corpus",
        "nyse-corpax-windowed-archive",
        "nyse-corporate-actions-client-spec"
      ],
      "continuity_notes": "The complete date-bounded Select Sector action-capable SEC corpus, issuer split notice, and NYSE identity/reorganization archive found no applicable unit-changing action.",
      "coverage_status": "COMPLETE"
    },
    {
      "symbol": "XLI",
      "fund_identity": "State Street Industrial Select Sector SPDR ETF",
      "coverage_start": "2020-06-26",
      "coverage_end": "2026-07-31",
      "conclusion": "NO-APPLICABLE-ACTION-FOUND",
      "action_ids": [],
      "evidence_ids": [
        "sec-sector-program-007-corpus",
        "nyse-corpax-windowed-archive",
        "nyse-corporate-actions-client-spec"
      ],
      "continuity_notes": "The complete date-bounded Select Sector action-capable SEC corpus, issuer split notice, and NYSE identity/reorganization archive found no applicable unit-changing action.",
      "coverage_status": "COMPLETE"
    },
    {
      "symbol": "XLK",
      "fund_identity": "State Street Technology Select Sector SPDR ETF",
      "coverage_start": "2020-06-26",
      "coverage_end": "2026-07-31",
      "conclusion": "APPLICABLE-ACTIONS-RECORDED",
      "action_ids": [
        "sector-spdr-XLK-2025-12-05-2-for-1"
      ],
      "evidence_ids": [
        "state-street-2025-sector-split-notice",
        "miax-2025-sector-split-alert",
        "sec-sector-2026-semiannual-note-13",
        "sec-sector-program-007-corpus",
        "nyse-corpax-windowed-archive",
        "nyse-corporate-actions-client-spec"
      ],
      "continuity_notes": "The complete date-bounded Select Sector action-capable SEC corpus records the 2-for-1 split effective 2025-12-05 and no other applicable unit-changing action.",
      "coverage_status": "COMPLETE"
    },
    {
      "symbol": "XLP",
      "fund_identity": "State Street Consumer Staples Select Sector SPDR ETF",
      "coverage_start": "2020-06-26",
      "coverage_end": "2026-07-31",
      "conclusion": "NO-APPLICABLE-ACTION-FOUND",
      "action_ids": [],
      "evidence_ids": [
        "sec-sector-program-007-corpus",
        "nyse-corpax-windowed-archive",
        "nyse-corporate-actions-client-spec"
      ],
      "continuity_notes": "The complete date-bounded Select Sector action-capable SEC corpus, issuer split notice, and NYSE identity/reorganization archive found no applicable unit-changing action.",
      "coverage_status": "COMPLETE"
    },
    {
      "symbol": "XLRE",
      "fund_identity": "State Street Real Estate Select Sector SPDR ETF",
      "coverage_start": "2020-06-26",
      "coverage_end": "2026-07-31",
      "conclusion": "NO-APPLICABLE-ACTION-FOUND",
      "action_ids": [],
      "evidence_ids": [
        "sec-sector-program-007-corpus",
        "nyse-corpax-windowed-archive",
        "nyse-corporate-actions-client-spec"
      ],
      "continuity_notes": "The complete date-bounded Select Sector action-capable SEC corpus, issuer split notice, and NYSE identity/reorganization archive found no applicable unit-changing action.",
      "coverage_status": "COMPLETE"
    },
    {
      "symbol": "XLU",